{
  "metadata": {
    "patternId": "code-templates",
    "patternName": "Code Templates Skill",
    "category": "quality",
    "stackAgnostic": false,
    "description": "Generate code from templates following project patterns",
    "composable": true
  },
  "frontmatter": {
    "name": "code-templates",
    "description": "Generate code from templates following project patterns and style guides",
    "type": "skill",
    "knowledge": ["naming-conventions.json"],
    "templates": ["templates/"]
  },
  "sections": {
    "title": "Code Templates Skill",
    "introduction": "Generates code following project patterns and the selected coding style guide.",
    "whenToUse": [
      "When creating new classes, interfaces, or modules",
      "When implementing service classes",
      "When creating utility classes",
      "When defining exception classes",
      "When writing test classes"
    ],
    "process": [
      {
        "step": 1,
        "name": "Detect Style Guide",
        "description": "Determine project's coding style",
        "actions": ["Check .cursorrules for style setting", "Detect from existing code if not configured"]
      },
      {
        "step": 2,
        "name": "Select Template",
        "description": "Choose appropriate template",
        "actions": ["Identify template type needed", "Locate template in templates/{style}/{type}/"]
      },
      {
        "step": 3,
        "name": "Gather Variables",
        "description": "Collect values for template variables",
        "actions": ["Identify required variables", "Ask user for missing values", "Apply naming conventions"]
      },
      {
        "step": 4,
        "name": "Generate Code",
        "description": "Create code from template",
        "actions": ["Read template file", "Replace all {VARIABLE} placeholders", "Apply style-specific naming"]
      }
    ],
    "templateCategories": [
      {"category": "service-class", "description": "Service layer classes with interfaces"},
      {"category": "utility-class", "description": "Reusable utility classes"},
      {"category": "exception-class", "description": "Custom exception classes"},
      {"category": "test-class", "description": "Unit test classes"},
      {"category": "interface", "description": "Interface definitions"},
      {"category": "model", "description": "Data model classes"}
    ],
    "importantRules": [
      "Style consistency - Match project's style guide",
      "Use templates - Read from templates/ folder, don't embed inline",
      "Follow patterns - Use established project patterns",
      "Complete code - Templates should produce functional code"
    ]
  },
  "variables": [
    {"name": "{CLASS_NAME}", "description": "Name of class to generate", "required": true},
    {"name": "{STYLE_GUIDE}", "description": "Coding style to use", "required": true}
  ]
}
