{
  "metadata": {
    "patternId": "extend-knowledge",
    "patternName": "Extend Knowledge Skill",
    "category": "core",
    "stackAgnostic": true,
    "description": "Extend the knowledge base with new topics, skills, and templates",
    "composable": true,
    "version": "1.0.0"
  },
  "frontmatter": {
    "name": "extend-knowledge",
    "description": "Extend knowledge base through research, documents, or user input",
    "type": "skill",
    "knowledge": ["manifest.json", "skill-catalog.json"],
    "templates": ["knowledge/knowledge-file.tmpl"]
  },
  "sections": {
    "title": "Extend Knowledge Skill",
    "introduction": "This skill enables extending the project's knowledge base with new topics, patterns, and skills. It supports multiple research methods and ensures systematic updates to all related artifacts.",
    "whenToUse": [
      "When adding knowledge about a new technology or framework",
      "When creating a new reusable skill",
      "When incorporating external documentation or links",
      "When the knowledge base has gaps for your project domain"
    ],
    "process": [
      {
        "step": 1,
        "name": "Identify Extension Type",
        "description": "Determine what type of artifact to create",
        "actions": [
          "Knowledge file - for patterns, conventions, best practices",
          "Skill - for reusable workflow procedures",
          "Template - for code or document generation"
        ]
      },
      {
        "step": 2,
        "name": "Research & Gather Information",
        "description": "Collect information for the extension",
        "methods": [
          "Web search - for up-to-date information",
          "Document reading - for provided PDFs or documentation",
          "User links - for specific URLs to incorporate",
          "Repository analysis - for existing codebase patterns"
        ]
      },
      {
        "step": 3,
        "name": "Generate Structured Content",
        "description": "Create the artifact following project conventions",
        "actions": [
          "Use templates/knowledge/knowledge-file.tmpl for knowledge files",
          "Use templates/factory/skill.md.tmpl for skills",
          "Follow JSON schema patterns for validation",
          "Include version, description, and axiom alignment"
        ]
      },
      {
        "step": 4,
        "name": "Update Related Artifacts",
        "description": "Ensure all dependent files are updated",
        "actions": [
          "Update knowledge/manifest.json with new entry",
          "Update knowledge/skill-catalog.json if skill created",
          "Validate JSON syntax",
          "Update documentation if needed"
        ]
      },
      {
        "step": 5,
        "name": "Validate & Verify",
        "description": "Ensure the extension is correct and complete",
        "actions": [
          "Run JSON validation on new files",
          "Check that imports/references work",
          "Verify integration with existing knowledge"
        ]
      }
    ],
    "outputFormat": "### Extension Complete\n\n| Artifact | Type | Path | Status |\n|----------|------|------|--------|\n| {NAME} | {TYPE} | {PATH} | Created/Updated |",
    "importantRules": [
      "ALWAYS follow existing knowledge file patterns",
      "ALWAYS update manifest.json after creating knowledge files",
      "ALWAYS validate JSON syntax before completing",
      "Include version numbers for traceability"
    ],
    "fallbackProcedures": [
      {"condition": "If topic is too broad", "action": "Ask user to narrow scope"},
      {"condition": "If no information found", "action": "Ask user for documentation links"},
      {"condition": "If JSON validation fails", "action": "Fix syntax errors before proceeding"}
    ]
  },
  "variables": [
    {"name": "{TOPIC}", "description": "Topic or domain to extend", "required": true},
    {"name": "{ARTIFACT_TYPE}", "description": "Type: knowledge|skill|template", "required": true}
  ]
}
